category,city,company_name,geo,job_board,job_description,job_title,job_type,post_date,salary_offered,state,url,average_salary,Salary
Construction,Melbourne,Hays Facilities Management,AU,seek," A Project Manager job delivering new build, fitout and refrub projects across Victoria. Your new company Are you an experienced and professional Project Manager? An immediate opportunity has become available for a Project Manager with a high profile government organisation in Melbourne. This position sits in the major projects team and is responsible for delivering a large portfolio of projects across Victoria. Your new role As a key member of the major projects team you will be required to deliver new build, refurb and fitout projects from conception to completion which includes but not limited to developing project briefs, seeking relevant approvals, engaging contractors/consultants, reporting on project milestones, liaising with internal and external stakeholders, managing variations that arise and overall delivery of projects. What you'll need to succeed To be successful you will have proven project management experience delivering building related projects and ideally within the government sector. You will be proactive, use initiative and have the ability to think outside the square. Superior communication skills both written and verbal is key for success in this role. What you'll get in return On offer is an exciting long term contract role with a government organisation that is well respected across the state. This organisation offers work life balance and a generous hourly rate. What you need to do now If you're interested in this role, click 'apply now' to forward an up-to-date copy of your CV, or send direct to tennille.hooper@hays.com.au now. If this job isn't quite right for you but you are looking for a new position, please contact us for a confidential discussion on your career. ",Project Manager,Contract/Temp,2018-04-16T00:25:07Z,52,Eastern Suburbs,https://www.seek.com.au/job/35990484,52,83200
Real Estate & Property,Sydney,Gough Property & Real Estate Recruiters,AU,seek,"Back in the 1980’s, Strata was not a common term nor a common job. Our client's Philosophy is to take action and make sense of individuals property needs.  The Role:  They are a successful boutique Strata Management agency based in Sydney's WEST  this established agency is committed to personalised service and exceeding client expectations. They require the services of a Client Liaison Officer to join their incredibly successful company. In this role some of your duties will include: General Administrative duties Liaising with clients by telephone and solving enquirers on a first instant basis  Client Projects as directed from Strata Managers  Support 1 Strata Manager Type Minutes / Agendas Issuing Key's to Contractors, Owners &amp; Tenants Assisting Clients with their Enquiries Strata Administration Understanding of Strata The candidate:  Possess Excellent Communication Skills You must have 6 Months experience in the strata industry  Have  Strong Attention to Detail with the Ability to Multi Task Have a High Level of Computer Skills Energy, integrity &amp; drive to succeed  Bilingual applicants encourages  Strong administration experience is a must  The successful candidate will receive full training and support from some of the best in the business. There will also be an opportunity for you to progress into a Strata Manager role in the future as this company is big fans of promoting internally. How to Apply: Apply for this exciting career opportunity now! Please email your CV to Georgia Barton on gbarton@goughrecruitment.com.au or for more information call on 02 9362 8500 or 0426 825 564.  ",Strata Assistant - Parramatta Area,Full Time,2018-04-12T06:15:31Z,$55K + Super!,Parramatta & Western Suburbs,https://www.seek.com.au/job/35971301,55,55000
Information & Communication Technology,Brisbane,TEKsystems,AU,seek," We are excited to be partnering with one of Australias leading retailers. Our client is an innovator in their space and are continuing to push the boundaries of innovation. As such, I am looking for a .NET Software Developer with 3+yrs experience that has a proven track record of taking initiative and thinking outside the box! If you thrive in an open and collaborative culture, are outgoing with a BIG personality - then I would love to have a chat with you and see if this is the perfect opportunity for you! You will need demonstrated extensive experience and knowledge in: HTML and CSS frameworks SQL Server Experience Good understanding of object oriented software development Strong understanding of and experience using relational databases Experience across multiple languages and platforms You can email Kelly.moore@teksystems.com or call Kelly Moore in our Brisbane office on (07) 3295 7423. Alternatively, apply here to register your interest. Note that these roles are only open to Permanent Residents, Australian Citizens and candidates that have Full Working Rights. People are at the heart of every successful business initiative. At TEKsystems (formerly Talent2), we understand people. Our deep insights into human capital management enable us to help our clients achieve their business goals - while optimising their IT workforce strategies. TEKsystems is an Allegis Group company. Allegis Group is the global leader in talent solutions with over 15,000 employees, 500 locations, 130,000 contractors and $12B in revenue ",.NET Software Developer,Full Time,2018-04-16T04:26:37Z,$80-90 k + super,Southern Suburbs & Logan,https://www.seek.com.au/job/35994556,85,56666.66667
Government & Defence,Sydney,"Randstad - Sales, Marketing & Communications",AU,seek," Our client, a NSW Government Department are looking for a Senior Marketing and Communications Advisor for an immediate start. This role is responsible for developing and implementing marketing and communications programs and for developing implementing and coordinating marketing plans for marketing campaigns to inform, motivate and influence customers to support corporate objectives. Key accountabilities Brand management to provide a single and consistent narrative across the organisation Contribute to the development and implementation of the overarching marketing and communications strategy (including social media, research, advertising, digital marketing etc) Lead the development and implementation of marketing and communications plans and campaigns (includingsocial media, research, advertising, digital marketing, brand management etc) to inform customers about services and the customer’s role in the service delivery process Project and campaign management across change and marketing functions (including review of project documents) to ensure timely and cost effective delivery of communication functions Copywriting for collateral and writing for business reporting ensuring a consistent editorial style across services and channels Provide advice, reports, campaign reports, strategic advice and support to the manager as required Participate in project delivery activities in order to deliver accurate project communications Relationship management of vendors and stakeholders to deliver accurate, timely and cost effective communication outcomes Development of appropriate merchandise and collateral to support digital integration to provide a consistent voice Work closely with the Corporate Relations team in coordinating a communications approach to ensure consistency and accuracy Essential requirements Demonstrated broad experience across senior marketing and communications roles. A high level understanding of government communications will be preferred Proven experience working in a lead communications and marketing role on large transformation projects, preferably with digital and customer outcomes focus Strong oral and written communication skills, especially developing and executing integrated business andmarketing communications strategies and plans Ability to work weekends if required ",Snr Marketing & Communications Officer,Contract/Temp,2018-04-13T07:02:43Z,$55 - $65 p.h. + Super,"CBD, Inner West & Eastern Suburbs",https://www.seek.com.au/job/35983800,60,96000
"Manufacturing, Transport & Logistics",Sydney,Australian Personnel Solutions,AU,seek," Our client, a large cold storage logistics company in Blacktown, are currently seeking reliable people for their packing area. Working in a fast paced packing environment you will be required to pack desert products into boxes, labelling of products and re pack work. To be Successful for one of these roles you MUST have: Own transport Ability to start immediately Previous pack/repack/assembly experience ""Can do"" attitude Ability to work in a cold storage environment (3-5 Degrees) Contactable references If you are looking for a long term job opportunity please forward your updated resume by clicking on the APPLY NOW button below. * Only successful applicants will be contacted* ",Pick Packers - Blacktown,Contract/Temp,2018-04-16T06:37:09Z,$24.73 per hour,Parramatta & Western Suburbs,https://www.seek.com.au/job/35996979,48.5,77600
Accounting,Perth,Walker Andersen,AU,seek,This well-established ASX listed organisation require an experienced Accounts Receivable Officer to join the team ASAP. You must have high attention to detail and be confident with a high volume data entry position.  Duties: Data entry of invoices Cash receipting Bank reconciliations Journal transfers Credit card payments Collection calls &amp; emails Setting up debtor accounts Prepping of BAS Skills &amp; Experience Required: Several years AR experience including high vol data entry Large ERP experience is preferred but not essential Intermediate MS Excel skills Good communication skills High accuracy ,Accounts Receivable Officer,Full Time,2018-04-11T03:15:57Z,$28-30p/h + Super,Northern Suburbs & Joondalup,https://www.seek.com.au/job/35957370,29,46400
Trades & Services,Perth,RecruitWest,AU,seek,"RecruitWest has exciting opportunities for Boilermakers / Welders for a 2 &amp; 1 FIFO roster located in the North West and Goldfields locations. These roles are available for an immediate start and you will be responsible for the maintenance and repair on all surface mining mobile equipment. Our client is one of the mining sectors leading contracting companies, working on many of the key projects within the resource sector. They offer long term roles with opportunities for career progression and permanent employment. We are looking for boilermakers with the following skills and experience:   Boilermaker Trade qualifications (Australian) Working at Heights ticket WA HR drivers Licence (minimum) Previous experience in the maintenance and repair to mining earthmoving machines, specifically Komatsu, Hitachi and CAT as well as fixed plant equipment Ability to pass pre-employment Medical and Drug &amp; Alcohol testing Previous remote work experience If you are interested in these great positions, please call Veronica on 08 9368 9814 or click APPLY NOW SK937573A   ",Boilermaker / Welder,Contract/Temp,2018-04-12T07:33:09Z,$46 - $49 per hour,"CBD, Inner & Western Suburbs",https://www.seek.com.au/job/35972629,47.5,76000
Human Resources & Recruitment,Melbourne,sportsbet.com.au,AU,seek," Head of Talent Leading a super passionate OD team whose core focus is to build Sportsbet’s future capability. You will lead and engage your team to design and execute a talent Strategy to enable our purpose of bringing excitement to life. You get to do this in an environment where your thought leadership in this space is truly valued and willingness to do it in a way that is different is welcomed. • Make your mark through shaping the organisational capability at Sportsbet • Create Sportsbet as the destination for Talent • Continue your own development journey by working on unique projects and being part of a talented leadership team Company Sportsbet is Australia’s leading online wagering company. We're part of a global company, a big player with a start-up soul. The pace of change is exhilarating, we’re constantly innovating to bring excitement to life for our customers and our people. Perks: • Free brekky, discounted gym memberships, loads of event tickets • Tailored career development programs, as well as a commitment to developing Thought Leader and Specialist Talent programs • Best in class Parental Leave program with six months paid leave for Primary Carers TEAM: You will be part of the HR Leadership Team, reporting to GM HR. You will also be part of a broader Customer and People team JOB • Lead a team of seasoned organisational development professionals • Design and lead the delivery of the talent strategy that ensures Sportsbet has the right capacity, culture and capability to deliver our purpose • Identify and drive innovative approaches to delivering high-quality, fit for purpose strategies for talent programs. • Accountability for the Implementation and management of programs to engage, recruit and develop critical future skills and emerging talent into our business. • Provide thought leadership to progressive talent approaches that will support the acquisition and development of talent and ensure that Sportsbet is proactively planning for the capabilities that deliver on our purpose • Deliver on the development of our leaders to support our culture aspiration • Deploy an employer brand strategy that positions Sportsbet in the market as the destination for talent. • Develop and deploy a core development strategy to engage and facilitate career development IS THIS ROLE FOR ME? • Strategic and conceptual thinker with an authentic and adaptive leadership style • Non-traditional thinker – led by commercial outcomes enabled by people rather than policy • Outcomes focused – ensuring the greatest impact is achieved • Strong knowledge, skills and experience across the breadth of Strategy development and implementation, Talent Development and acquisition, OD Frameworks, models, assessments and methodologies within innovative environments. • Articulate communicator, with demonstrated experience to influence stakeholders to innovative outcomes WHAT’S NEXT ONCE YOU APPLY…FIND OUT HERE: At Sportsbet, we take Responsible Gambling very seriously. Check out the tools and information we provide our customers to help manage their gambling on our dedicated site at www.responsiblegambling.sportsbet.com.au ",Head of Talent,Full Time,2018-04-15T20:00:50Z,+ 5 Weeks Annual Leave + Company Bonus,CBD & Inner Suburbs,https://www.seek.com.au/job/35988159,5,250000
Construction,Melbourne,Design & Construct,AU,seek," Due to a reputation for delivering quality projects this respected Tier 2 civil contractor is seeing consistent growth and now require an experienced Site Supervisor to join their team. The company Having been established for over 50 years and working across a number of sectors this growing contractor are a well-known business that have a solid reputation in the market. They have strong staff retention with all senior management having been with the business for 10+ years and pride themselves in developing people so they can grow within the company. The role The role of Site Supervisor will see you work closely with Project Managers, Engineers, relevant state bodies and sub-contractors in driving the project to ensure it meets programme whilst maintaining quality and OH&S standards across the board. You will predominantly be working on Vic Roads projects which could consist of slipways, roads, bridges, highways, roundabouts and more with projects usually values ranging from $3m-$100m. About you To be successful in the role you must have an extensive background as a Site Supervisor ideally with VIC roads experience. You will be very personable, be willing to travel when need be, have a passion for the industry and the ability to drive and motivate people in a positive manner. What’s in it for me? In return for your hard work you will be compensated with a remuneration package of between $130K- $150k+ Super + Car. In addition to this you will get to work with a great team who like to develop staff and offer genuine career progression opportunities. Apply For more information on the role please call Ross Dalton on 0433 348 227, send a copy of your CV to ross@designandconstruct.com.au or apply below. ",Site Supervisor- VIC Roads- Bridges,Full Time,2018-04-16T07:00:27Z,$130k - $150k p.a. + Super+ Car,Western Suburbs,https://www.seek.com.au/job/35997447,140,140000
Healthcare & Medical,Brisbane,Sigma Resourcing Pty Ltd,AU,seek,"An opportunity exists for a VR General Practitioner to join a reputable private practice located in the Southern suburbs of Brisbane near Acacia Ridge. It is a DWS area.    The Surgery currently employs 6 doctors, and will soon be expanding the size of their premises to cater to the ever growing patient base.   A range of services are provided, including travel vaccine clinics, diabetes clinics, women's health services, care plans and General Practice. They have onsite allied health including a Chiropractor, Podiatrist and a Psychologist.  You will have a degree of flexibility with your hours.   What to expect:  70% of  billings Excellent team environment Modern fit-out Fully computerised Allied health services Strong patient base To be successful: Must have current AHPRA registration Must have FRACGP or equivalent Must be an Australian Resident  To Apply: Send a copy of your updated CV to daniel@sigmaresourcing.com.au or call 0450 039 100 ",Female VR General Practitioner (FRACGP) - Acacia Ridge Area - DWS - 70% Billings,Full Time,2018-04-16T05:30:53Z,250K +,Southern Suburbs & Logan,https://www.seek.com.au/job/35995722,250,250000
Healthcare & Medical,Sydney,Sugarman Australia,AU,seek," The organisation The clinic in a multi-disciplinary care centre with an emphasis on team work and patient care. They specialise in musculoskeletal and sports rehab providing the best quality care to a wide variety of different clients. The clinic is state of the art and boasts onsite gym and pool facilities as well as a lively atmosphere. In the clinic you will be working alongside 4 other physiotherapists, GP's, XRay and other Allied Health practitioners. The benefits F/T employment + benefits Excellent remuneration + bonuses Full clinical support Contractor pay option (% basis) Admin Support Commitment to training and development A friendly and supportive team Essential criteria Have good Manual Therapy skills Have excellent communication Have a fantastic work ethic Full AHPRA registration Experience would be desirable but not essential If you would like to register your interest in this exciting role click apply now and upload your resume today! Alternatively for a confidential chat about the position please contact Benedict Lavery on 0295 495 700 or via email on benedict.lavery@sugarmangroup.com.au ",Physiotherapist,Full Time,2018-04-16T06:39:42Z,$79999 - $99999 p.a. + Super,North West & Hills District,https://www.seek.com.au/job/35997028,89999,89999
"Manufacturing, Transport & Logistics",Sydney,en world Australia,AU,seek," The Company My client is a multinational 3PL with a standout brand and service across the entire globe. Due to continuous growth and a busy time of year they are currently looking for an energetic Customer Service Agent to join their freight forwarding business. Reporting to the Branch Manager this position has a strong focus on service and operational efficiency. The Role Your main responsibilities will include: Liaising with local and overseas carriers Cover a portfolio of clients moving cargo FCL, LCL cargo duties & Air Handling of Customer specific enquiries or requirements import / Export Consignment tracking and monitoring Ensure all cargo is clear and all impediments are met to enable delivery Build strong and lasting relationships with customers and provide second-to-none customer service. Take full responsibilities and end-to-end ownership of customer shipments and issues. Engage in constructive problem resolution and provide solutions. Act and communicate proactively and keep customers informed of any issues or changes in the booking. Your Experience Minimum 1-2 years experience in a similar role Some cartage and import/export exposure Sound interpersonal and communication skills; We are looking for a good attitude & are happy to train the right person If you have any further questions please contact Stuart Alpen on 02-9431-6518. ",Customer Service,Full Time,2018-04-16T01:14:04Z,$50k - $52k p.a. + super,Parramatta & Western Suburbs,https://www.seek.com.au/job/35991317,51,51000
Banking & Financial Services,Sydney,Robert Walters,AU,seek," This role exists to develop, embed, maintain and improve the assessment guidelines and processes to ensure that all customers are treated fairly and consistently and remediated (where required) in the most effective and efficient manner Role Description Develop and improve the assessment guidelines, methodology, processes and tools that facilitate the identification of inappropriate advice and adviser conduct Develop, maintain and improve the methodology and processes that are applied in the remediation of customers who have received inappropriate advice or service. Ensure that all assessment guidelines, methodology, processes and tools are understood and applied by all key stakeholders. Serve as an effective escalation function for the assessment team and ensure that all decisions are effectively documented, approved and disseminated to all relevant stakeholders. • Develop innovative ways to remediate specific issues while ensuring quality is maintained Role Requirements Minimum 5 years financial services industry experience, with sound knowledge of financial products. Previous roles or exposure to Advising, Para planning, Complaints, Compliance or Training experience desirable. Advanced Excel/Word skills Ability to review advice decisions based on file documentation and supporting information and form a determination of appropriate or inappropriate advice. Ability to unpack the critical factors that inform an appropriate or inappropriate outcome assessment. Excellent written and verbal communication skills To apply please click apply or call Alison Hogan on +61 2 8289 3124 for a confidential discussion. ",Remediation Consultant,Contract/Temp,2018-04-16T07:10:59Z,$100k - $110k p.a. + STI Bonus,North Shore & Northern Beaches,https://www.seek.com.au/job/35997667,105,105000
Human Resources & Recruitment,Sydney,Frazer Jones,AU,seek," The Organisation My client is one of the world’s leading global technology organisations in the Healthcare industry. They have strong values, are growing, and are looking to attract exceptional talent to the organisation. The Role This is an exceptional opportunity for an ambitious and passionate professional to be part of a wider team in a high performing and rewarding environment. The pace is fast, and you will need to keep up with it, and thrive off it. You could have a background in sales and be looking to transition into an HR/recruitment role. It will be important that you enjoy a KPI and results focussed work environment. The majority of your time will be dedicated to end to end recruitment, working with the wider business to fill recruitment needs, and finding exceptional talent to build and improve your pipeline. You will love speaking to people and being the face of the organisation. You will also work in collaboration with the wider HR team; helping with the on boarding and exit process and other adhoc projects as and when required. You will coach managers on the hiring processes & how to best source and identify talent. In addition, you will coach & develop the HR team on the recruitment process. Your skills & attributes As an ambitious professional, you will be continually challenged and looking to grow your career in an exceptional organisation where you are rewarded for your hard work and positive attitude. You will also have: The ability to build strong relationships with internal & external stakeholders An interest in working in a fast paced, and a high performing environment Agile and flexible What you will get in return A competitive salary package, salary will be dependent on experience Bonus & other incentives Training & support Genuine career progression For more information on the role, or for a confidential chat, please contact Charlotte Grimmett on 0292369090 or email charlottegrimmett@frazerjones.com.au SR Group is acting as an Employment Agency in relation to this vacancy. ",Talent Acquisition Specialist,Full Time,2018-04-16T05:55:00Z,$70k - $100k p.a. + super + benefits,North Shore & Northern Beaches,https://www.seek.com.au/job/35996153,85,85000
